{
  "$schema": "https://json-schema.org/draft/2020-12/schema",
  "$id": "https://calendar-pilot.local/contracts/raw_calendar_observation.schema.json",
  "title": "RawCalendarObservationV1",
  "type": "object",
  "required": ["observation_id", "user_scope_id", "observed_at", "time_zone_id", "events"],
  "properties": {
    "observation_id": {"type": "string"},
    "user_scope_id": {"type": "string"},
    "observed_at": {"type": "string", "format": "date-time"},
    "time_zone_id": {"type": "string"},
    "events": {
      "type": "array",
      "items": {
        "type": "object",
        "required": ["event_id", "title", "start", "end"],
        "properties": {
          "event_id": {"type": "string"},
          "title": {"type": "string"},
          "start": {"type": "string", "format": "date-time"},
          "end": {"type": "string", "format": "date-time"},
          "calendar_id": {"type": "string"},
          "attendees": {"type": "array", "items": {"type": "string"}},
          "location": {"type": "string"},
          "notes": {"type": "string"},
          "is_user_owned": {"type": "boolean"},
          "is_flexible": {"type": "boolean"},
          "category": {"type": "string"}
        }
      }
    },
    "tasks": {"type": "array"},
    "device_context": {"type": "object"},
    "notification_history": {"type": "array"},
    "prior_actions": {"type": "array"}
  }
}
